<?xml version="1.0" encoding="UTF-8"?>

<!--
    Document   : collection.xml
    Created on : February 24, 2012, 7:21 AM
    Author     : drew
    Description:
-->

<collection name="biological" id="1"
            xmlns:xsi="http://www.w3.org/2001/XMLSchema-instance"
            xsi:noNamespaceSchemaLocation="http://www.cloudsuite.info/schema/collection.xsd"
            >
    <desc>
        A Collection of modules used in genetically inspired computing.
    </desc>
    <ownerID>22</ownerID>
    <clearance>10</clearance>
    <created>2012.02.11</created>
    <module name="ga" id="7">
        <methodName></methodName>
        <parameterString></parameterString>
        <sequenceNumber></sequenceNumber>
        <desc>Genetic algorithm for pattern matching</desc>
        <input></input>
        <output></output>
    </module>
    <module name="neuro" id="8">
        <methodName></methodName>
        <parameterString></parameterString>
        <sequenceNumber></sequenceNumber>
        <desc>Initializing Neural net</desc>
        <input></input>
        <output></output>
    </module>
</collection>
