<?xml version="1.0" encoding="UTF-8"?>

<!--
    Document   : collection.xml
    Created on : February 24, 2012, 7:21 AM
    Author     : drew
    Description:
-->

<collection name="cryptography" id="20"
            xmlns:xsi="http://www.w3.org/2001/XMLSchema-instance"
            xsi:noNamespaceSchemaLocation="http://www.cloudsuite.info/schema/collection.xsd"
            >
    <ownerID>22</ownerID>
    <clearance>10</clearance>
    <created>2012.02.11</created>
    <module name="rsa" id="21">
        <methodName></methodName>
        <parameterString></parameterString>
        <sequenceNumber></sequenceNumber>
        <desc>Encrypt using RSA</desc>
        <input></input>
        <output></output>
    </module>
    <module name="hash-crack" id="232">
        <methodName></methodName>
        <parameterString></parameterString>
        <sequenceNumber></sequenceNumber>
         <desc>Crack a hash file.</desc>
        <input></input>
        <output></output>
    </module>
    <desc>A Collection of modules used for cryptographic purposes.</desc>
</collection>
