<?xml version="1.0" encoding="UTF-8"?>

<!--
    Document   : collection.xml
    Created on : February 24, 2012, 7:21 AM
    Author     : drew
    Description:
-->

<collection name="Graphing" id="10"
            xmlns:xsi="http://www.w3.org/2001/XMLSchema-instance"
            xsi:noNamespaceSchemaLocation="http://www.cloudsuite.info/schema/collection.xsd"
            >
    <desc>
        A Collection of modules used to display quantative data.
    </desc>
    <ownerID>22</ownerID>
    <clearance>10</clearance>
    <created>2012.02.11</created>
    <module name="graphs" id="11">
        <methodName></methodName>
        <parameterString></parameterString>
        <sequenceNumber></sequenceNumber>
        <desc>Chart some data yo</desc>
        <input></input>
        <output></output>
    </module>
</collection>
